listing_id,id,date,reviewer_id,reviewer_name,comments
51307,315895,2011-06-15,547939,Therese,The Spanish Bungalow Guest House was a fabulous place to stay. It had everything we needed and more. Great location. David was very friendly and made us feel welcome immediately. Lots of great tips about the area - and a real gentleman -- noticed our Smart Car with canadian plates when we were on the highway approaching his place - and gave us the personal escort! Excellent experience with airbnb - will definitely continue to use the services provided through this site.
51307,346266,2011-07-01,691851,Fly,Cute place. David is a sweet person and the neighborhood is quiet clean and hip.
51307,355054,2011-07-05,681448,Janelle,David was a great host.. He was very nice and his place did not disappoint.. It looked just like the pictures!
51307,394788,2011-07-25,653529,Laura,"Cozy and cute bungalow in a nice, quiet neighborhood, accessible to lots of great LA spots. David is a great host. The house is small but adorable and has everything you need for a great stay."
51307,431961,2011-08-09,787606,Laura,"This is our first time using Airbnb. We had the best time! David's little bunglow is adorable and close to everything! The neighborhood is very nice and quiet. Even though we have family that live in LA and could stay somewhere for free, I would rather come back and stay here! It is the perfect little getaway. :)"
51307,441967,2011-08-13,603832,Michele,Really cute place; great location! David was really nice.
51307,491967,2011-09-01,422712,Joaquin,This place was perfect for a couple or just one person. I had the best time for two weeks. David was really helpful and gave us what we needed and answered all my questions. Great stay and great host
51307,520805,2011-09-11,705146,Kobi,"David is a very nice guy.
<br/>The apartment is very nice and clean
<br/>The location was excellent"
51307,536791,2011-09-16,1026604,Franziska,"Really nice house in a neighbourhoody part of LA! David was such a friendly, polite and helpful host! we say THANK YOU and do highly recommend!"
51307,549607,2011-09-20,795435,Megan,"My husband I visited LA for a few days and stayed at David's Bungalow; this was my first experience using AirNB.  David was an excellent communicator and very easy to email and reach by phone.  The Bungalow's location was ideal and the neighborhood a perfect option for those not wanting to stay downtown.  Parking our rental car was a breeze and we walked to neighborhood breakfast spots on the days we were there.  The Bungalow accommodations were between a hostel and hotel: not high comfort but, not minimal either."
51307,596523,2011-10-04,878167,Rolando,"David's guest house truly felt like a home away from home. It's charming, and nestled in a serene neighborhood. It's located in an incredibly convenient location, minutes from the 5, Los Feliz and Hollywood. 
<br/>
<br/>David does a great job of communicating and is very pleasant and helpful. Recommend a stay here to all."
51307,636301,2011-10-17,1101748,Charles,"Great place to stay in Atwater Village! Looks just like the pictures. You can walk to several places for coffee, drinks or food. Parking is ample. Quiet street, except for an occasional dog or two. Very close to Griffith park. Really enjoyed staying here. David was a very kind and accommodating host who will provide plenty of information."
51307,697429,2011-11-07,955942,Rebekah,"This was the perfect location for us, and a really great host! Thanks David, we had a blast :)"
51307,713741,2011-11-13,517356,Mike,"The Spanish Bungalow was a great value!  It has all the basic necessities to feel comfortable, including a very nice/modern kitchen area.  Being so close to the 5 was awesome as you feel like you can be anywhere in the city within 15 minutes.  It's also so nice to be near Griffith Park.  David was very accommodating -- coming out to meet me with the key at 11:30 pm due to my flight arriving so late in the evening was tremendous."
51307,757364,2011-12-01,183942,Jessica,We loved staying at David's little guest house. It's a quaint and cozy place!
51307,764825,2011-12-05,1129270,Sujata,"A lovely home and get-a-away.  David has sweetly appointed the space, and we felt very much at home.  A great, central location when in LA.  When we're back in town, we'll definitely plan to stay here again!"
2708,284617908,2018-07-01,93292025,Harjinder,Wow; Charles was a delight to meet a very warm and friendly man whom made me feel comfortable and at ease throughout my stay. Truly someone I will remember for his warmth and generosity. The apartment was homley and the location was perfect for anyone whom is looking for central proximity. I strongly recomend this place as your 1st choice.
2708,291375787,2018-07-15,183639942,Taylor,Chas. has a great space ! Loved how clean everything was and how available he was to help out with anything I needed!
2708,296879491,2018-07-26,37846734,John,"Chas is a great host, very friendly and welcoming (and informative!).  He keeps his place spotless and quiet, so this is a great location for people looking to relax or reset from a day out in Los Angeles.  The location is amazing and walkable to many stores and restaurants.  I especially enjoyed the in-building sauna and spa as a way to unwind at the end of the day.   In addition, the underground, secured parking is a great find (especially in the summer heat).  I'll definitely stay here next time I'm in the area."
2708,306500549,2018-08-12,48408491,Andrew,"Charles place is lovely and in a great location. Very central and close to things nearby. The small private gym and sauna are a great little touch I used a lot. The bed was big and really comfortable and Charles is an accommodating, friendly and informative host. Great find"
2708,319965969,2018-09-07,51146446,Stephanie,Charles's place is great! It is very clean and centrally located. He also goes out of his way to make sure that you enjoy your stay.
2708,358265929,2018-12-13,118296038,Aziz Ibrahim,"Charles place will not disappoint for a second, it has all necessities needed to have a comfortable stay. As a person that is sensitive to dust,  I really appreciated that the apartment is clean and has good ventilation. The location of the apartment is incredible you really are a split second from alot of happenings. I really enjoyed my stay and I hope to be back very soon. On top of the great apartment, Charles as a host is truly an unicorn. Very good at communication, understanding the needs of the guest and making sure the stay is comfortable. Truly an unique experience!"
2708,417933068,2019-02-28,153706631,Andrea,"Chas is an amazing host and I absolutely recommend his place. It's very clean, you have enough privacy and the location is great too, as there is everything like restaurants, grocery and metro station in walking distance. I had an awesome time there and really enjoyed my stay!"
2708,425630420,2019-03-18,13903098,Tami,"Chas. is an excellent host, and this is a great location and a great space. Chas. was very accommodating even when my flight was delayed, and he was always willing to go the extra mile to make sure that I was happy with everything about my stay. This is a great location even if you do not have a car, since public transportation is plentiful in this area and there are also a lot of restaurants and shops in easy walking distance, but Chas. also made it easy for me to park my car in his building. All in all, this was a great stay, and I highly recommend it."
2708,443320279,2019-04-25,228846650,Stefanie,"I had an amazing time at Charles place. He made me feel very welcome and comfortable. The location is amazing and you can find many shops and restaurants in walking distance. Charles is an incredibly kind, informative and helpful host. <br/>I will definitely stay here again the next time I am in LA!"
2708,448958815,2019-05-05,2126071,Kj,"Chas was very hospitable! I would stay here again. The Location was perfect, walking distance to everything I needed, and the bed was very comfortable. Everyone kept to themselves so it felt private and he was there if I needed anything. I recommend!!"
2708,452259654,2019-05-12,141434769,Matthew,"As you might have gleaned from the other reviews, Chas was amazing. A gracious and warm welcome was followed by a sparkling clean appartment. There was a mutual respect between everyone and there was a relaxing sense of silence and peace in the space."
2708,456137752,2019-05-20,249489563,Morgan,"I had a great time at Charles place, he is a great host in every possible way. The room (and the common areas)<br/>is cozy, nice and clean. The bed is very comfortable, there is a desk and plenty of space for storage should you need it.<br/>This place has everything you're likely to need on your travels, highly recommended!"
2708,501551096,2019-08-03,249142508,Steven,Great place and great location. Charles is very friendly and very accommodating.
2708,521262231,2019-08-31,32253750,Adrian,"Chas place is a gem, conveniently located to shops , grocery stores, night life entertainment and more. Easy to get around as everything is close by.   <br/>In addition his place is as described and even better; very serene, neat, and most especially comfortable. <br/>Chas is a warm and welcoming host , and ensures the place is always kept clean as much as possible.  Highly recommend to anyone visiting Los Angeles."
2708,576181646,2019-12-12,79475501,Jenny,"Wonderful hospitality, strongly recommend!"
2708,619302203,2020-03-17,117823684,Nathan,"Location is decent (near some great music stores, restaurants, and a lot of other things to do). The room itself is decent. I didn't know that the room wouldn't offer any blockage from sounds in the living room, because it didn't have a closed wall. The bed stank of body odor before I got there, so I had to Febreeze the bed multiple times over to make it usable, but there was a Febreeze bottle available. <br/><br/>There were a few days that I had to be sure to be out of the room, because the owner was having work done on the door that was attached to my room. It was an unforeseen inconvenience, but he made up for it by giving me $10 for lunch.<br/>One one of those days that I was waiting for the workers in the room, I happened to be outside the main door and the building owner came by and told me that there were to be absolutely no AirBnB guests in the building. That, of course, freaked me out. I told the owner of the room of what just happened and he told me that rule only applied to short term stays, not long term guests. So that was resolved.<br/><br/>In case of a pandemic (like the COVID-19) be aware that your money won't be returned, even after a personal discussion with the owner about the current issues and the necessity to return home early. Not even a week after I returned home, LA put just about everything on lockdown and there was a high chance that I wouldn't have been able to return home at all if I stayed for the original plan. The owner and I spoke about it and he agreed to give me a refund and I offered to give him some money in return for all the trouble that it caused. A week later, I received a message from AirBnB, saying that he decided not to return anything at all  to me in the midst of the pandemic and in spite of our discussion and my perceived mutual understanding. <br/><br/>Because of his policy, he is within his rights to keep the money. I had only hoped that our verbal agreement would've been honored."
51307,781547,2011-12-12,1476431,Lucas,"We spend 3 days there.
<br/>House is nice and cozy.
<br/>David is a nice guy. 
<br/>I recommend to anyone that is going to LA to stay in his place.
<br/>Very convenient.
<br/>
<br/>"
51307,828753,2012-01-03,1105637,Teresa,"My husband and I booked the bungalow for part of our honeymoon, we booked it for 9 days total. My first impression was positive, the neighborhood was very nice and quite with easy access to the freeway. David was also very nice, he waited for us to arrive to make sure we got in okay.  
<br/>Everything in the bungalow was like the pictures, but what my husband and I weren't happy about was the smell. It has a very strong animal odor and the house was poorly cleaned. The mattress was old and very uncomfortable so we didn't sleep very well. 
<br/>"
51307,1233113,2012-05-06,1710288,Gary,"For my wife and I  a great location as our daughter lives 4 blocks away so we were able to walk over every morning so see our new grand daughter.
<br/>You could go two blocks down and eat at the village bakery or play golf at a par 3 course; walk the in the other direction you have a Starbucks, a great wine store and a links and beer place with over 20 beers on tap. Close to drug stores,gas ,dry cleaning etc.  If our daughter is still at this location we will be renting again.
<br/>G.Parker"
51307,1267803,2012-05-12,2198328,Angel,"Beautiful, safe neighborhood down the road from Los Feliz restaurants/bars/Griffith Park. Excellent choice if you plan on staying on the east side. Not as desirable if you want beaches everyday. 
<br/>
<br/>The I-5 entrance is only a few blocks away and about a 5-7 minute drive to downtown (assuming there is no traffic).  
<br/>
<br/>Don't feel like going anywhere, the local neighborhood has some cute restaurants, coffeeshops/bakeries & cool dive bars."
51307,1382548,2012-05-30,306787,Marie & Peter,"David's space is perfect. Everything you might need is available; well-stocked spice cabinet with condiments, coffee and teas. Outdoor space delightful, fabulous neighbors and neighborhood - walk to LA River walk/bike path. Walk to shops on Los Feliz. Easy on/off 5 freeway. Comfortable furnishings. Great price!"
51307,1803107,2012-07-26,2224683,Richard,Bungalow was just right for my wife and i;stayed 1week while visiting my son.Neighbors were great and neighborhood very nice.Would definetly stay again.
51307,1958807,2012-08-12,298982,Marcus,"David was very helpful and easy to get along with.
<br/>The house is an amazing place to stay, great location, and plenty of tour guides left on the bench!
<br/>Looking forward to visiting again!"
51307,2439253,2012-09-28,786142,Carter,This was the first of many trips my wife will be taking with me now that our kids are freed and I wanted it to be a nice experience. David's place was perfect. There is plenty in walking distance to do and the accommodations are quite comfortable for two. Would certainly recommend.
51307,2657206,2012-10-19,1699336,Carmel,"A totally charming place in a lovely quiet neighborhood a stone's throw from Silverlake.  The kitchen was well-equipped, the decor was stylishly vintage and David was a very amiable host.  Only one wish.....internet.
<br/>Other than that, it was perfect.  I'll definitely stay again!"
51307,2767078,2012-10-30,3960112,Mai,The place was very nice and exactly as advertised. David was very friendly and helpful.
51307,2896842,2012-11-16,2125082,Vickie,"Great place, great location.  This cute apartment is located in awesome Atwater Village.  Everything is in walking distance.  It's great.  The apartment is super cute and has everything you'd need ... a balcony, a back yard ... easy parking ... lovely decor.  It was perfect.  I'll be back.  The host is wonderful too!"
51307,3177132,2012-12-29,3532458,Jiyoung,"It was a well-equipped beautiful bungalow in a good location. We really enjoyed our stay, and would like to stay there again when we visit LA next time."
51307,4739224,2013-05-22,6287781,Andrea,David & his guesthouse were amazing!!! Perfect location & great feel!!! I LOVED IT!!!!
51307,5426798,2013-06-29,5486822,Anne-Laure,The reservation was canceled 11 days before arrival. This is an automated posting.
51307,5535734,2013-07-04,851630,Cary,"We had a wonderful stay at David's charming spanish bungalow!  Wonderful location, beautiful neighborhood, plenty of street parking, beautifully appointed with a well equipped kitchen including washer/dryer.  We arrived later than expected and David greeted us cheerfully with helpful driving directions and orientation to the neighborhood.  We will definitely be returning!"
51307,6594721,2013-08-18,7692259,Ashley,"Delightful home-away-from-home and host. Complete apartment (LR, DR, kitchen, bathroom, and BR) with air conditioner in BR for nights when LA heat was just too much. Completely comfortable, a 1/2 mile walk from Glendale Blvd, and a 1 mile walk from the folks I was visiting just north of Silver Lake Blvd. Very clean and the bed was comfy. Trying to think of something to complain about, I can only come up with too many decorative pillows on the bed that I had to pile on the floor every night!"
51307,6923917,2013-08-30,3658759,Firas,Everything was very good. Cool house - nice area!!!
51307,7398074,2013-09-18,8266574,Ann,The apartment was very charming in a quiet neighborhood. Great location and convenient parking in front of the home. David was a great host. We enjoyed our visit and time in California - looking forward to coming back.
51307,7760562,2013-10-01,8988774,Simha,We stayed 1 week at the apartment. Worked out great for us. Location was perfect and the apartment had everything we needed. There was a problem of cellular receiving and without wifi we felt a bit disconnected.
51307,8530254,2013-11-04,6228570,Ashley,"Our stay here was wonderful. The location is great, just off the 5 fwy and there is lots of street parking. The house itself is cute and quaint with all of the basic amenities that we needed. Our host was very nice and easy to communicate with. Would definitely stay here again!"
51307,8981328,2013-11-30,7692259,Ashley,So nice to stay somewhere with books to read when my own supply runs out!
51307,10234208,2014-02-08,11274765,Barry,Terrific place.  David is super nice and friendly.
185557,17414636,2014-08-11,19553852,Yuanyuan,"It's been a great pleasure staying with Laura. She is so helpful, picking me up at the airport, taking me to my school and even inviting me to a Shakespeare show on the first day! And the house is cute with quiet neighborhood and the location is convenient, also all bathroom toiletries are supplied. Thanks Laura for offering me a great place to stay on my first arrival of US and I will definitely come back if needed."
2708,632352136,2020-06-26,275399037,Tom,Charles was not only a gracious and accommodating host but he’s also full of insight and really cares about his guests.<br/><br/>He is an outstanding resource so use him!<br/><br/>The best way to get the most out of your experience with him is to talk to him and really understand he has the best intention for you!<br/><br/>I would recommend Charles to anyone new to the LA area and really do consider him a friend!
185557,69212578,2016-04-10,56757681,Lucy,"Laura was amazing. She was eager to meet up beforehand, and took the time to make sure that my stay was comfortable and exactly what I wanted. The area is beautiful and quiet, and walking distance to pretty much anything you need (including a great library). It's a wonderful place, and she is very helpful."
185557,90114315,2016-07-31,54454044,Fern,"Laura has a comfortable, clean home with a convenient location but it is her warm gracious spirit that makes for a 5 star air b&b. Enthusiastic thumbs up!"
185557,155710043,2017-05-28,26912245,Mary,I stayed here for 3 months while going through an intense program. I always felt safe and comfortable. Laura has a warm welcoming personality! Her doggies are wonderful as well.
185557,226447822,2018-01-10,89981176,Alana,"Was a real pleasure to meet Laura and stay there for a month. Great hospitality, amazing location, respectful people, comfy bedroom for a good price. I couldn’t ask for more! I highly recommend this place :)"
185557,358520171,2018-12-14,151854391,Li Ni,Laura is a kind and sweet person. I would recommend this place for a short stay or even longer!
185557,401977369,2019-01-16,105844280,Hannah,"Laura was a great host! she helped me with everything I needed and is such a caring host! the house is beautiful and has a lot of special touches. great location in a safe nice neighborhood. close to venice, culver, marina del Rey and tons of stores and restaurants around. perfect place to stay in LA"
185557,572748429,2019-12-03,173844555,Katy,Great location and great hospitality!
185557,652467986,2020-08-16,265318075,Lyubov,"Like to say had a great month in CA  Really peaceful and great rest in that difficult time at Laura home.Did my  yoga on the backyard ,great  two miles to the Beautifull Beach  Playa Del Ray and good rest at the my room.<br/><br/>Thank you again Laura."
185557,744740945,2021-04-02,63383391,Theresse,"Stayed a month at Laura's home, and it was the perfect place to get acquainted with Los Angeles. Was close enough to the beach that I could walk there and is located in a quiet and nice town that has a lots of trails and beautiful views. Laura was very hospitable and made my stay very enjoyable!"
185557,485587674554861699,2021-10-31,414558258,Lily,"Laura is a very welcoming host who wants to make sure your needs are met. House is also in a prime location of Los Angeles for someone who is new to the area. Close to the beach, LAX, lots of shops, and parks."
51307,10978506,2014-03-16,1836899,Laura,"David was a lovely guy met him at the beginning and end of my booking.  I highly recommend David's place it's in a great spot in atwater village, walking distance to great places and on a beautiful street."
51307,11114018,2014-03-21,191564,Myleen,Very charming space and great location. Perfect space for 2 people. The lack of wi-fi wasn't missed since we spent most of our time out and about. Lot's of great options within walking distance. Would definitely stay here again.
51307,11384664,2014-03-31,3943056,Katie,David was super accommodating. He met me at the location and handed off the keys. Everything was exactly as described. It was such a lovely neighborhood too. One of the best in LA in my opinion. I would totally stay at David's again and probably will next time I'm in LA.
51307,11500832,2014-04-05,13682426,Samantha,"Great little place, lots of space, cute decor.  Everything was clean and there was plenty of pots, pans, and coffee making devices.  The location is excellent and the neighborhood is quiet.  There's a Trader Joe's right down the street for quick groceries.  I would recommend this spot to anyone staying in L.A.  David was a wonderful host with plenty of information."
51307,12635973,2014-05-06,14487457,Katie,"David was great, very nice and friendly. The space was exactly as described and reasonably priced. Great location, near freeways, walking distance from plenty of eateries, stores and pubs with tons of nearby activities. Wonderful neighborhood, everyone was very friendly. Bed was nice and comfy with lots of pillows. There was an AC unit in the bedroom, but the rest of the house was a bit hot, no central air. Given that I am from UT and not used to the warm weather (99 degrees) it may have just been me. There was a portable fan provided which certainly helped. Overall I enjoyed my stay very much and would definitely stay again! I will (and already have) recommended the house to others."
51307,13154693,2014-05-20,14854967,Reggie,Had my mother and grandmother visiting from out of town. I guess this rental was meant to be as David had full accommodations for elderly individuals. Loved the furnishings of the apartment and sitting on the porch with a view of Griffith Park. David was a pleasure to work with and was in constant communication with any arrangements that had to be made. David made my first airbnb experience a pleasurable one.
51307,14736414,2014-06-25,14583747,Victoria,The location was suitable for our needs. We have family in the area and were out all day everyday. The building is quaint and classic Atwater Village. There's plenty of space for two. The problem for us is that it heated to an unbearable degree during the day because we had no way to adequately ventilate it. We would rent it again for a winter vacation. June is just too hot for this garage apartment.
51307,16061743,2014-07-21,14609911,Matthew,"David was a very good host,"
51307,16782511,2014-08-02,17051124,Jenae,Great host and cozy bungalow! Would definitely visit again. Very nice neighborhood. My partner and I were able to go for runs outside the majority of our stay.
51307,17125802,2014-08-07,11055950,Sarah,"Be careful because you owe more money AFTER YOU ARRIVE.  He requires you to pay the 14% occupancy tax after arrival (this is hidden somewhere in the description of the location, but certainly isn't apparent.  When you arrive, he asks for too much personal information (afraid of identity theft anyone???).  Also, more obvious in the description, but good to remember that there is no WiFi or television at this spot.  And it's really hot everywhere except the bedroom."
51307,18188515,2014-08-23,18803491,Sarah,"We greatly enjoyed our stay - excellent location, nice space, and a friendly host!"
51307,18435463,2014-08-26,1409688,Wesley,"David was a great host, he was flexible with our check in time and went through the whole place with us.  The apartment was very nice, a little warm during the day but cooled down readily with all windows open at night.  The neighborhood is really nice and parking is readily available for free.  You can walk to a nice bakery for breakfast.  We would definitely recommend d this place."
